{
  "dateKey": "2026-09-05",
  "generatedAt": "2026-09-05T05:00:00+08:00",
  "title": "DailyTen｜9月5日",
  "subtitle": "冲突、能源与极端天气都在传导到日常成本",
  "briefLabel": "今天先看这些",
  "doneLabel": "已读",
  "readTimeMinutes": 8,
  "items": [
    {
      "id": "ukraine-security-hq-strike",
      "cat": "国际局势",
      "icon": "drone",
      "title": "俄罗斯无人机袭击乌克兰安全机构总部",
      "brief": "这意味着俄乌战事的打击目标再升级，停火谈判前的安全风险也更高了。",
      "take": "乌克兰总统泽连斯基说，俄罗斯发动无人机袭击，击中了乌克兰安全机构总部；乌方将其称为一次明显升级。对普通人来说，这不只是远方的军事新闻：战事若扩大到更多政府与城市设施，人员安全、难民压力、欧洲能源和食品价格都更难稳定，也会让任何谈判更难推进。",
      "meta": "9月4日｜乌克兰",
      "facts": [
        [
          "袭击目标",
          "乌方称安全机构总部遭俄罗斯无人机击中。"
        ],
        [
          "乌方表态",
          "泽连斯基称这次行动是严重升级。"
        ],
        [
          "谈判背景",
          "美国特使据报将前往莫斯科和基辅斡旋。"
        ]
      ],
      "visual": null,
      "impacts": [
        [
          "安全",
          "城市和关键机构面临更高空袭风险。"
        ],
        [
          "生活成本",
          "战事延长可能继续推高能源和粮食的不确定性。"
        ]
      ],
      "next": [
        "核实袭击造成的人员和设施损失。",
        "关注美方特使访问能否带来停火接触。"
      ],
      "source": "BBC News",
      "updated": "2026-09-04",
      "en": {
        "cat": "Geopolitics",
        "title": "Russia strikes Ukrainian security headquarters with drones",
        "brief": "The attack raises the stakes before ceasefire talks and adds to wider security risks.",
        "take": "Ukrainian President Volodymyr Zelensky said a Russian drone attack hit the headquarters of Ukraine's security service, which Kyiv called a major escalation. This matters beyond the battlefield: if attacks spread across more state and city infrastructure, safety risks, displacement, and uncertainty over European energy and food prices can all grow, while negotiations become harder to move forward.",
        "meta": "Sept. 4 | Ukraine",
        "facts": [
          [
            "Target",
            "Ukraine said the headquarters of its security service was hit by Russian drones."
          ],
          [
            "Ukraine's view",
            "Zelensky described the operation as a major escalation."
          ],
          [
            "Talks backdrop",
            "US envoys are reported to be visiting Moscow and Kyiv to seek progress."
          ]
        ],
        "visual": null,
        "impacts": [
          [
            "Safety",
            "Cities and critical institutions face greater air-attack risk."
          ],
          [
            "Household costs",
            "A longer war can keep energy and food costs uncertain."
          ]
        ],
        "next": [
          "Confirm the human and physical damage from the strike.",
          "Watch whether the US envoys create an opening for ceasefire talks."
        ],
        "source": "BBC News",
        "updated": "2026-09-04"
      },
      "sourceLinks": [
        {
          "title": "Russia hits Ukrainian security headquarters in drone attack, Zelensky says",
          "url": "https://www.bbc.co.uk/news/articles/c5yep7y48x2o?at_medium=RSS&at_campaign=rss",
          "publisher": "BBC News"
        },
        {
          "title": "Russia strikes Ukraine intelligence HQ in ‘major escalation’",
          "url": "https://www.theguardian.com/world/2026/sep/04/russia-strikes-ukraine-intelligence-hq-kyiv-major-escalation",
          "publisher": "The Guardian"
        }
      ],
      "eventImage": {
        "url": "https://ichef.bbci.co.uk/ace/branded_news/1200/cpsprodpb/1829/live/70faa890-a888-11f1-b109-879e35c24276.jpg",
        "credit": "BBC News",
        "link": "https://www.bbc.co.uk/news/articles/c5yep7y48x2o?at_medium=RSS&at_campaign=rss",
        "zh": {
          "alt": "俄罗斯无人机袭击乌克兰安全机构总部",
          "caption": "俄罗斯无人机袭击乌克兰安全机构总部"
        },
        "en": {
          "alt": "Russia strikes Ukrainian security headquarters with drones",
          "caption": "Russia strikes Ukrainian security headquarters with drones"
        }
      }
    },
    {
      "id": "us-envoys-moscow-kyiv",
      "cat": "国际局势",
      "icon": "alert",
      "title": "特朗普的和平特使周末将访问莫斯科和基辅",
      "brief": "两边都要见不代表马上停火，但至少出现了重新直接沟通的窗口。",
      "take": "BBC报道称，特朗普的和平特使计划周末分别到访莫斯科和基辅，推动俄乌冲突的外交接触。这并不等于协议已近在眼前，尤其是在双方仍互相发动袭击的情况下；但能否建立直接沟通、讨论停火条件，仍会影响欧洲安全、粮食运输和能源市场的后续波动。",
      "meta": "周末计划｜莫斯科、基辅",
      "facts": [
        [
          "访问安排",
          "特朗普的和平特使计划周末访问莫斯科和基辅。"
        ],
        [
          "任务",
          "此行意在推动俄乌冲突的外交接触。"
        ],
        [
          "现实阻碍",
          "访问消息发布当天，乌方仍报告遭到俄方无人机袭击。"
        ]
      ],
      "visual": {
        "type": "chain",
        "label": "可能的外交路径",
        "nodes": [
          "分别会见",
          "沟通条件",
          "讨论停火",
          "后续谈判"
        ]
      },
      "impacts": [
        [
          "风险",
          "外交接触若中断，军事和经济外溢风险会继续上升。"
        ],
        [
          "价格",
          "黑海运输和欧洲能源预期会随谈判进展波动。"
        ]
      ],
      "next": [
        "关注双方是否公布具体会谈议题。",
        "观察是否出现临时停火或人道安排。"
      ],
      "source": "BBC News",
      "updated": "2026-09-04",
      "en": {
        "cat": "Geopolitics",
        "title": "Trump's peace envoys to visit Moscow and Kyiv this weekend",
        "brief": "Meeting both sides does not mean a ceasefire is close, but it opens a channel for direct contact again.",
        "take": "BBC reports that Trump's peace envoys plan to visit Moscow and Kyiv over the weekend to pursue diplomatic contact over the war in Ukraine. That is not the same as having a deal, especially while attacks continue. But whether the sides can speak directly and discuss ceasefire terms will affect European security, grain shipping, and energy-market volatility.",
        "meta": "Weekend plan | Moscow and Kyiv",
        "facts": [
          [
            "Travel plan",
            "Trump's peace envoys are expected to visit Moscow and Kyiv this weekend."
          ],
          [
            "Purpose",
            "The trip is intended to revive diplomatic contact over the war."
          ],
          [
            "Obstacle",
            "Ukraine reported a Russian drone attack on the same day the visit was announced."
          ]
        ],
        "visual": {
          "type": "chain",
          "label": "Possible diplomatic path",
          "nodes": [
            "Meet each side",
            "Set conditions",
            "Discuss a ceasefire",
            "Continue negotiations"
          ]
        },
        "impacts": [
          [
            "Risk",
            "If contact breaks down, military and economic spillover risks remain high."
          ],
          [
            "Prices",
            "Black Sea shipping and European energy expectations may move with the talks."
          ]
        ],
        "next": [
          "Watch for details on the agenda from either side.",
          "Look for any temporary ceasefire or humanitarian arrangement."
        ],
        "source": "BBC News",
        "updated": "2026-09-04"
      },
      "sourceLinks": [
        {
          "title": "Trump's peace envoys to visit Moscow and Kyiv over weekend",
          "url": "https://www.bbc.co.uk/news/articles/c23x0z48x0no?at_medium=RSS&at_campaign=rss",
          "publisher": "BBC News"
        }
      ],
      "eventImage": {
        "url": "https://ichef.bbci.co.uk/ace/branded_news/1200/cpsprodpb/0e39/live/bcf0df00-a86d-11f1-bbad-43eaf67b94b6.jpg",
        "credit": "BBC News",
        "link": "https://www.bbc.co.uk/news/articles/c23x0z48x0no?at_medium=RSS&at_campaign=rss",
        "zh": {
          "alt": "特朗普的和平特使周末将访问莫斯科和基辅",
          "caption": "特朗普的和平特使周末将访问莫斯科和基辅"
        },
        "en": {
          "alt": "Trump's peace envoys to visit Moscow and Kyiv this weekend",
          "caption": "Trump's peace envoys to visit Moscow and Kyiv this weekend"
        }
      }
    },
    {
      "id": "europe-sabotage-campaign",
      "cat": "国际局势",
      "icon": "alert",
      "title": "欧洲面临一波疑似与俄罗斯有关的破坏活动",
      "brief": "电缆、交通和其他基础设施一旦被盯上，普通人的出行和通信都可能先受影响。",
      "take": "BBC报道，欧洲多地出现不断升级的破坏事件，俄罗斯是主要嫌疑对象。报道没有说所有事件都已被最终证实由俄方策划，但这类风险已让欧洲把注意力从前线战场延伸到海底电缆、铁路和其他日常基础设施。对居民和企业而言，后果可能是交通中断、网络服务受影响，以及安保和公共维护成本上升。",
      "meta": "9月4日｜欧洲",
      "facts": [
        [
          "事件性质",
          "欧洲正调查一系列不断升级的破坏事件。"
        ],
        [
          "主要嫌疑",
          "报道指出俄罗斯是主要嫌疑对象。"
        ],
        [
          "关注重点",
          "关键基础设施成为欧洲安全担忧的一部分。"
        ]
      ],
      "visual": null,
      "impacts": [
        [
          "日常服务",
          "通信、交通或能源设施受扰可能影响日常安排。"
        ],
        [
          "公共成本",
          "政府和企业可能增加基础设施防护投入。"
        ]
      ],
      "next": [
        "关注各国调查是否公布可核实证据。",
        "留意欧盟是否推出共同的基础设施保护措施。"
      ],
      "source": "BBC News",
      "updated": "2026-09-04",
      "en": {
        "cat": "Geopolitics",
        "title": "Europe faces a growing campaign of suspected sabotage",
        "brief": "If cables, transport links, or other infrastructure are targeted, travel and communications can be hit first.",
        "take": "BBC reports a spiralling series of sabotage incidents across Europe, with Russia the chief suspect. The report does not say every case has been conclusively tied to Moscow, but the concern has pushed European security attention beyond the front line to undersea cables, railways, and other everyday infrastructure. For households and businesses, the possible effects include disrupted travel, weaker network services, and higher costs for protection and repairs.",
        "meta": "Sept. 4 | Europe",
        "facts": [
          [
            "Pattern",
            "European countries are investigating a growing series of sabotage incidents."
          ],
          [
            "Main suspect",
            "The report identifies Russia as the chief suspect."
          ],
          [
            "Focus",
            "Critical infrastructure is becoming a central security concern."
          ]
        ],
        "visual": null,
        "impacts": [
          [
            "Daily services",